[
  {
    "id": "alert-stock-so2",
    "siteId": "11111111-1111-4111-8111-111111111111",
    "entityType": "stock",
    "entityId": "19191919-1919-4191-8191-191919191919",
    "severity": "warning",
    "message": "Stock SO2 sous seuil minimal",
    "status": "open",
    "triggeredAt": "2026-05-18T09:00:00.000Z",
    "createdAt": "2026-05-18T09:00:00.000Z",
    "updatedAt": "2026-05-18T09:00:00.000Z"
  }
]
